link_id,url,video_id,author,author_url,title,description,duration_sec,view_count,like_count,comment_count,share_count,hashtags,thumbnail_url,fetched_at,fetch_status,fetch_provider,error_message
1,https://www.tiktok.com/@gadgetglimpse/video/7376304558559071530,7376304558559071530,gadgetglimpse,https://www.tiktok.com/@gadgetglimpse,"Keep your baby’s bottle warm on-the-go! 🍼👶 This portable warmer heats water, formula milk, or breast milk to the perfect temperature in just 5 minutes. With a 7-hour battery life and USB-C charging, it’s ideal for busy parents.  **LINK IN BIO** Available Now: Babymoov Portable Bottle Warmer Moov & Feed Follow @gadgetglimpse to discover more interesting products. #BabyEssentials #TravelWithBaby #ParentingHacks #BabyCare #NewParents","Keep your baby’s bottle warm on-the-go! 🍼👶 This portable warmer heats water, formula milk, or breast milk to the perfect temperature in just 5 minutes. With a 7-hour battery life and USB-C charging, it’s ideal for busy parents.  **LINK IN BIO** Available Now: Babymoov Portable Bottle Warmer Moov & Feed Follow @gadgetglimpse to discover more interesting products. #BabyEssentials #TravelWithBaby #ParentingHacks #BabyCare #NewParents",31,58300,300,9,93,"[""BabyEssentials"", ""TravelWithBaby"", ""ParentingHacks"", ""BabyCare"", ""NewParents""]",https://p16-common-sign.tiktokcdn.com/tos-useast5-p-0068-tx/159d8cdabd83431c86d5f35a7f78467e_1717429747~tplv-tiktokx-dmt-logom:tos-useast5-i-0068-tx/oM4jguECsAnsC7kfIyXwyKAIDfA2FHAAOEAMeQ.image?dr=14573&x-expires=1782374400&x-signature=m1sX%2FY42Nuz3Aixy6BNrp55O79k%3D&t=4d5b0474&ps=13740610&shp=81f88b70&shcp=55bbe6a9&idc=my,2026-06-23T08:00:57+00:00,ok,playwright,
2,https://www.tiktok.com/@eugenie.strawderman/video/7440471494041275678,7440471494041275678,eugenie.strawderman,https://www.tiktok.com/@eugenie.strawderman,"PART THREE: Having a portable bottle warmer makes heating your baby's bottles on the go so easy.  This one has a long battery, fits in your diaper bag, and is easy to clean. If you don’t have one yet, I highly recommend getting one during its Black Friday sale ⚡️🙌🏻 #portablebottlewarmer #bolololife #bololoportablebottlewarmer #bololo #exclusivelypumping #blackfriday #pumpingmom #pumpingmama #musthaves #momsoftiktok #momlife #momhack #fyp #fy #foryou #foryoupage","PART THREE: Having a portable bottle warmer makes heating your baby's bottles on the go so easy.  This one has a long battery, fits in your diaper bag, and is easy to clean. If you don’t have one yet, I highly recommend getting one during its Black Friday sale ⚡️🙌🏻 #portablebottlewarmer #bolololife #bololoportablebottlewarmer #bololo #exclusivelypumping #blackfriday #pumpingmom #pumpingmama #musthaves #momsoftiktok #momlife #momhack #fyp #fy #foryou #foryoupage",65,10900,122,2,18,"[""portablebottlewarmer"", ""bolololife"", ""bololoportablebottlewarmer"", ""bololo"", ""exclusivelypumping"", ""blackfriday"", ""pumpingmom"", ""pumpingmama"", ""musthaves"", ""momsoftiktok"", ""momlife"", ""momhack"", ""fyp"", ""fy"", ""foryou"", ""foryoupage""]",https://p19-common-sign.tiktokcdn.com/tos-useast8-p-0068-tx2/oYIA7xA3EiNOEXAiO3zCBBYBoIGsK0AfAAoiBI~tplv-tiktokx-dmt-logom:tos-useast8-i-0068-tx2/octIAUQEf4A3EAnbdFdAEiEABD1YfAAzRAC2BV.image?dr=14573&x-expires=1782374400&x-signature=RPMZpqr3QXo9LDomrzlRgCpjdxs%3D&t=4d5b0474&ps=13740610&shp=81f88b70&shcp=55bbe6a9&idc=my,2026-06-23T08:01:44+00:00,ok,playwright,
3,https://www.tiktok.com/@babybrezza/video/7383388217879383339,7383388217879383339,babybrezza,https://www.tiktok.com/@babybrezza,"🍼💡 Baby's milk, perfectly warm with the tap of your phone with the Smart Bottle + Breastmilk Warmer! #smartparenting #bottlewarmer #babybrezza #newparents #babymusthave","🍼💡 Baby's milk, perfectly warm with the tap of your phone with the Smart Bottle + Breastmilk Warmer! #smartparenting #bottlewarmer #babybrezza #newparents #babymusthave",8,68100,435,10,129,"[""smartparenting"", ""bottlewarmer"", ""babybrezza"", ""newparents"", ""babymusthave""]",https://p16-common-sign.tiktokcdn.com/tos-useast5-p-0068-tx/o0gOBf0sCiApIHEOMBzwiAm3EoI4AV2NRBwwsQ~tplv-tiktokx-origin.image?dr=14575&x-expires=1782374400&x-signature=YfgwVgTdkx%2Fms%2FMVmi7bAx5MmpI%3D&t=4d5b0474&ps=13740610&shp=81f88b70&shcp=55bbe6a9&idc=my,2026-06-23T08:01:49+00:00,ok,playwright,
4,https://www.tiktok.com/@elliamalone/video/7280005363171151146,7280005363171151146,elliamalone,https://www.tiktok.com/@elliamalone,@momcozy MW03 portable bottle warmer! So great for travel and the perfect size!! #momcozy #momcozybottlewarmer #momcozybottlewarmerreview #bottlewarmer #portablebottlewarmer #bottlewarmerreview #babymusthaves #travelingwithbabies #drbrownsbottles @Dr. Brown's,@momcozy MW03 portable bottle warmer! So great for travel and the perfect size!! #momcozy #momcozybottlewarmer #momcozybottlewarmerreview #bottlewarmer #portablebottlewarmer #bottlewarmerreview #babymusthaves #travelingwithbabies #drbrownsbottles @Dr. Brown's,86,46400,495,43,117,"[""momcozy"", ""momcozybottlewarmer"", ""momcozybottlewarmerreview"", ""bottlewarmer"", ""portablebottlewarmer"", ""bottlewarmerreview"", ""babymusthaves"", ""travelingwithbabies"", ""drbrownsbottles""]",https://p16-common-sign.tiktokcdn.com/tos-useast5-p-0068-tx/50d3417989ee4570a71421acbdada935_1695008352~tplv-tiktokx-dmt-logom:tos-useast5-i-0068-tx/oQjEfDSngcACPYxebAlRDAAWIqPdGBQg8wCAsS.image?dr=14573&x-expires=1782374400&x-signature=jBxB%2FGtRufOg6xHVbnObrLMCDok%3D&t=4d5b0474&ps=13740610&shp=81f88b70&shcp=55bbe6a9&idc=my,2026-06-23T08:02:48+00:00,ok,playwright,
5,https://www.tiktok.com/@kaylatwinmom/video/7442474674031693099,7442474674031693099,kaylatwinmom,https://www.tiktok.com/@kaylatwinmom,this makes being out or on the go for feedings SO MUCH easier🩵#tiktokshopblackfriday #momcozy #bottlewarmer #bottles #drbrowns #drbrownbottles #onthego #momlife #momsoftiktok #twinmom #twinsoftiktok,this makes being out or on the go for feedings SO MUCH easier🩵#tiktokshopblackfriday #momcozy #bottlewarmer #bottles #drbrowns #drbrownbottles #onthego #momlife #momsoftiktok #twinmom #twinsoftiktok,46,6420,48,6,5,"[""tiktokshopblackfriday"", ""momcozy"", ""bottlewarmer"", ""bottles"", ""drbrowns"", ""drbrownbottles"", ""onthego"", ""momlife"", ""momsoftiktok"", ""twinmom"", ""twinsoftiktok""]",https://p16-common-sign.tiktokcdn.com/tos-useast5-p-0068-tx/oUtmECRERS3fynaWegDPuQLSIAYn6oDVkC0DFB~tplv-tiktokx-origin.image?dr=14575&x-expires=1782374400&x-signature=Ago7BvWY%2FNuT%2FjkSWNF51163QAY%3D&t=4d5b0474&ps=13740610&shp=81f88b70&shcp=55bbe6a9&idc=my,2026-06-23T08:03:21+00:00,ok,playwright,
6,https://www.tiktok.com/@beeandtheboys/video/7158923548579499310,7158923548579499310,beeandtheboys,https://www.tiktok.com/@beeandtheboys,My favorite warmer #bottlewarmer #drbrownbottles #drbrowns #liquidgold #colostrum #sickbaby #rsv #rsvawareness #rsvseason #StemDrop001 #FomotionalFinds #breastmilkstillbestforbabies😊 #breastmilksupply #breastmilkisthebestmilk #pumpingmom #pumpingmama #pumpinglife,My favorite warmer #bottlewarmer #drbrownbottles #drbrowns #liquidgold #colostrum #sickbaby #rsv #rsvawareness #rsvseason #StemDrop001 #FomotionalFinds #breastmilkstillbestforbabies😊 #breastmilksupply #breastmilkisthebestmilk #pumpingmom #pumpingmama #pumpinglife,12,68600,267,18,125,"[""bottlewarmer"", ""drbrownbottles"", ""drbrowns"", ""liquidgold"", ""colostrum"", ""sickbaby"", ""rsv"", ""rsvawareness"", ""rsvseason"", ""StemDrop001"", ""FomotionalFinds"", ""breastmilkstillbestforbabies"", ""breastmilksupply"", ""breastmilkisthebestmilk"", ""pumpingmom"", ""pumpingmama"", ""pumpinglife""]",https://p16-common-sign.tiktokcdn.com/tos-useast5-p-0068-tx/4dc06e4f240e4126a676418d80f41a4c_1666816796~tplv-tiktokx-dmt-logom:tos-useast5-i-0068-tx/34027e41cbfc4941b08b255694fb35dc.image?dr=14573&x-expires=1782374400&x-signature=n%2FvjNJjw%2BoBjbQ9rZ%2FUhbZ2cX1w%3D&t=4d5b0474&ps=13740610&shp=81f88b70&shcp=55bbe6a9&idc=my,2026-06-23T08:03:27+00:00,ok,playwright,
7,https://www.tiktok.com/@courtneybb04/video/7426873794754546974,7426873794754546974,courtneybready,https://www.tiktok.com/@courtneybready,Replying to @alissaa.mariee21 Seriously this Momcozy bottle washer is an absolute life saver for us!!!! Hope this helps! #momcozy #momcozybottlewasher #automaticbottlewasher #babyessentials #babymusthaves #momsoftiktok #babiesoftiktok,Replying to @alissaa.mariee21 Seriously this Momcozy bottle washer is an absolute life saver for us!!!! Hope this helps! #momcozy #momcozybottlewasher #automaticbottlewasher #babyessentials #babymusthaves #momsoftiktok #babiesoftiktok,52,82700,860,57,162,"[""momcozy"", ""momcozybottlewasher"", ""automaticbottlewasher"", ""babyessentials"", ""babymusthaves"", ""momsoftiktok"", ""babiesoftiktok""]",https://p16-common-sign.tiktokcdn.com/tos-useast8-p-0068-tx2/ad49dd7fc29b49789d383f02e0bbbe96_1729203819~tplv-tiktokx-origin.image?dr=14575&x-expires=1782374400&x-signature=dm9mFr4Hn5PIZUxPkPXteZvJ74Q%3D&t=4d5b0474&ps=13740610&shp=81f88b70&shcp=55bbe6a9&idc=my,2026-06-23T08:03:54+00:00,ok,playwright,
8,https://www.tiktok.com/@simply_chella/video/7506642110834281774,7506642110834281774,chellaxkhy,https://www.tiktok.com/@chellaxkhy,Mommy Essentials @Dr. Brown's got you covered with the bottles and bottle warmer!,Mommy Essentials @Dr. Brown's got you covered with the bottles and bottle warmer!,12,12000,75,5,7,[],https://p16-common-sign.tiktokcdn.com/tos-useast5-p-0068-tx/oUZsIn2g0EpGC4Bz8AFibcliIBBBhuAa7wfg2g~tplv-tiktokx-origin.image?dr=14575&x-expires=1782374400&x-signature=QlmpXZKg9VnvcITmc%2BC7D8uMmzY%3D&t=4d5b0474&ps=13740610&shp=81f88b70&shcp=55bbe6a9&idc=my,2026-06-23T08:04:00+00:00,ok,playwright,
9,https://www.tiktok.com/@cupcakegaboo/video/7106665278041394478,7106665278041394478,cupcakegaboo,https://www.tiktok.com/@cupcakegaboo,This is so much better than regular bottle warmers that take forever to warm milk. @drbrownsbaby fix those leaky bottles. @Baby Brezza has definitely made feedings easier. #fyp #babybrezza #drbownsbottles,This is so much better than regular bottle warmers that take forever to warm milk. @drbrownsbaby fix those leaky bottles. @Baby Brezza has definitely made feedings easier. #fyp #babybrezza #drbownsbottles,59,39200,1333,58,30,"[""fyp"", ""babybrezza"", ""drbownsbottles""]",https://p16-common-sign.tiktokcdn.com/tos-useast5-p-0068-tx/ca17e989e8274abf97dc6a121875d785~tplv-tiktokx-origin.image?dr=14575&x-expires=1782374400&x-signature=e0795sa%2Bg3JLBX6XmfNiKBpIsyg%3D&t=4d5b0474&ps=13740610&shp=81f88b70&shcp=55bbe6a9&idc=my,2026-06-23T08:04:40+00:00,ok,playwright,
10,https://www.tiktok.com/@claudiadelrio1/video/7472050129772629290,7472050129772629290,claudiadelrio1,https://www.tiktok.com/@claudiadelrio1,"Try the momcozy portable bottle warmer with me💕😊 This was our first time trying the @Momcozy Official portable bottle warmer! First impression was great! I thought the milk would take a while to warm up but nope! It warmed it within a few minutes, which is great when you have a hangry baby! This is definitely something I didn’t know I needed and am so grateful for! If your baby is like mine and has to have warm milk, a bottle warmer is a must whether it’s for home use or on the go! I will definitely be packing this in the diaper bag permanently and using it everywhere we go! 😊 #secondtimemom #boymom #bottlewarmer #momcozy #onthego #drbrowns #drbrownbottles #evenflo","Try the momcozy portable bottle warmer with me💕😊 This was our first time trying the @Momcozy Official portable bottle warmer! First impression was great! I thought the milk would take a while to warm up but nope! It warmed it within a few minutes, which is great when you have a hangry baby! This is definitely something I didn’t know I needed and am so grateful for! If your baby is like mine and has to have warm milk, a bottle warmer is a must whether it’s for home use or on the go! I will definitely be packing this in the diaper bag permanently and using it everywhere we go! 😊 #secondtimemom #boymom #bottlewarmer #momcozy #onthego #drbrowns #drbrownbottles #evenflo",50,1420,25,1,1,"[""secondtimemom"", ""boymom"", ""bottlewarmer"", ""momcozy"", ""onthego"", ""drbrowns"", ""drbrownbottles"", ""evenflo""]",https://p16-common-sign.tiktokcdn.com/tos-useast5-p-0068-tx/o4QCh2ACciabABJAYz3XIwwAciEQfB3BIyDi9L~tplv-tiktokx-origin.image?dr=14575&x-expires=1782374400&x-signature=SCYPVuizvcHs%2FoMiMS0iamUdDKU%3D&t=4d5b0474&ps=13740610&shp=81f88b70&shcp=55bbe6a9&idc=my,2026-06-23T08:05:11+00:00,ok,playwright,
11,https://www.tiktok.com/@brbvicky/video/7516360043470654750,7516360043470654750,brbvicky,https://www.tiktok.com/@brbvicky,looking rough here but it was water park weekend !!!! breaking news the @Momcozy Official @momcozy travel bottle warmer’s Dr Browns adapter fits the new Munchkin bottle! we’ve switched over to the Munchkin and couldn’t be happier….. even happier bc we can use our bottle warmer with it! ❤️ Momcozy travel milk warmer Momcozy portable milk warmer #portablemilkwarmer #travelmilkwarmer #momcozymilkwarmer  Munchkin silicone coated glass baby bottle Silicone coated glass baby bottle Silicone baby bottle Glass baby bottle Munchkin bond  #munchkinbond #siliconecoatedglassbabybottle,looking rough here but it was water park weekend !!!! breaking news the @Momcozy Official @momcozy travel bottle warmer’s Dr Browns adapter fits the new Munchkin bottle! we’ve switched over to the Munchkin and couldn’t be happier….. even happier bc we can use our bottle warmer with it! ❤️ Momcozy travel milk warmer Momcozy portable milk warmer #portablemilkwarmer #travelmilkwarmer #momcozymilkwarmer  Munchkin silicone coated glass baby bottle Silicone coated glass baby bottle Silicone baby bottle Glass baby bottle Munchkin bond  #munchkinbond #siliconecoatedglassbabybottle,19,3089,50,3,1,"[""portablemilkwarmer"", ""travelmilkwarmer"", ""momcozymilkwarmer"", ""munchkinbond"", ""siliconecoatedglassbabybottle""]",https://p16-common-sign.tiktokcdn.com/tos-useast8-p-0068-tx2/o4S1eBaBeRA9xIgEEeLeAlAqv8eAaIQFaAGsEf~tplv-tiktokx-origin.image?dr=14575&x-expires=1782374400&x-signature=UJf3UfU7e9vYlYfQRdsBU4SkCyY%3D&t=4d5b0474&ps=13740610&shp=81f88b70&shcp=55bbe6a9&idc=my,2026-06-23T08:05:18+00:00,ok,playwright,
12,https://www.tiktok.com/@racheljoanmyers/video/7462847085394644270,7462847085394644270,racheljoanmyers,https://www.tiktok.com/@racheljoanmyers,PSA you’ll literally cry  #parentingtips #drbrowns #drbrownbottles #newborn #newborntips #pp #pumpingmom #pumpingtips #bottlefeeding #bottlewarmer,PSA you’ll literally cry  #parentingtips #drbrowns #drbrownbottles #newborn #newborntips #pp #pumpingmom #pumpingtips #bottlefeeding #bottlewarmer,23,507500,8147,203,3358,"[""parentingtips"", ""drbrowns"", ""drbrownbottles"", ""newborn"", ""newborntips"", ""pp"", ""pumpingmom"", ""pumpingtips"", ""bottlefeeding"", ""bottlewarmer""]",https://p16-common-sign.tiktokcdn.com/tos-useast5-p-0068-tx/oUPiZBA4BbicBFKRuBEEIPKDgt2XXXbpA65U5~tplv-tiktokx-origin.image?dr=14575&x-expires=1782374400&x-signature=UhRaDSBW99gvpEHH5jtG%2BlWahTc%3D&t=4d5b0474&ps=13740610&shp=81f88b70&shcp=55bbe6a9&idc=my,2026-06-23T08:05:22+00:00,ok,playwright,
13,https://www.tiktok.com/@chels_morgan97/video/7431553642110487838,7431553642110487838,chels_morgan97,https://www.tiktok.com/@chels_morgan97,Dr.Brown’s bottles just make me mad anymore 😤 always leaking and clogged.  @Momcozy Official I think its time to make bottles to go with your #bottlewarmer  #momcozylife #momcozy #momcozybottlewarmer #makeabottlewithme #drbrowns #drbrownbottles #newmom #momlife #breastmilkbybottle,Dr.Brown’s bottles just make me mad anymore 😤 always leaking and clogged.  @Momcozy Official I think its time to make bottles to go with your #bottlewarmer  #momcozylife #momcozy #momcozybottlewarmer #makeabottlewithme #drbrowns #drbrownbottles #newmom #momlife #breastmilkbybottle,36,13700,72,3,9,"[""bottlewarmer"", ""momcozylife"", ""momcozy"", ""momcozybottlewarmer"", ""makeabottlewithme"", ""drbrowns"", ""drbrownbottles"", ""newmom"", ""momlife"", ""breastmilkbybottle""]",https://p16-common-sign.tiktokcdn.com/tos-useast8-p-0068-tx2/osEeUXCjqMOpReIiXAATADWFI8l1rfIQkTQcFD~tplv-tiktokx-origin.image?dr=14575&x-expires=1782374400&x-signature=1yNFvB9D3DLCs8VxN%2FVlR06Soa4%3D&t=4d5b0474&ps=13740610&shp=81f88b70&shcp=55bbe6a9&idc=my,2026-06-23T08:05:48+00:00,ok,playwright,
14,https://www.tiktok.com/@adiiariiss/video/7295379796677201183,7295379796677201183,adiiariiss,https://www.tiktok.com/@adiiariiss,#youngmomsoftiktok #howto #drbrownbottlewarmer,#youngmomsoftiktok #howto #drbrownbottlewarmer,56,97000,1335,27,168,"[""youngmomsoftiktok"", ""howto"", ""drbrownbottlewarmer""]",https://p16-common-sign.tiktokcdn.com/tos-useast8-p-0068-tx2/ocpLIVEDqOfE38PBZlmeEP6QVlFwrRAPyvBASA~tplv-tiktokx-origin.image?dr=14575&x-expires=1782374400&x-signature=egzSuNitNDDMHbYeRxdRHJcmCy0%3D&t=4d5b0474&ps=13740610&shp=81f88b70&shcp=55bbe6a9&idc=my,2026-06-23T08:06:26+00:00,ok,playwright,
15,https://www.tiktok.com/@kimberly.michellee/video/7460374667765894442,7460374667765894442,kimberly.michellee,https://www.tiktok.com/@kimberly.michellee,#exclusivelypumping #pumpingmom #pumpingtok #breastmilk #momcozybottlewarmer,#exclusivelypumping #pumpingmom #pumpingtok #breastmilk #momcozybottlewarmer,36,41500,877,47,96,"[""exclusivelypumping"", ""pumpingmom"", ""pumpingtok"", ""breastmilk"", ""momcozybottlewarmer""]",https://p16-common-sign.tiktokcdn.com/tos-useast5-p-0068-tx/o8ILmEkGPCkeB1hLIGvScAQyIHnIeEuAhjQ0eh~tplv-tiktokx-origin.image?dr=14575&x-expires=1782374400&x-signature=OK34vpouEVwscjmCAg7XGbFTmCU%3D&t=4d5b0474&ps=13740610&shp=81f88b70&shcp=55bbe6a9&idc=my,2026-06-23T08:06:42+00:00,ok,playwright,
16,https://www.tiktok.com/@lazykelly/video/7229018143182785838,7229018143182785838,Kelly Kay,https://www.tiktok.com/@lazykelly,"HOW DARE YOU DR BROWNS, GET IT TOGETHER! #drbrowns #babyproducts #review #babyreview #millennialmom #millennialmoms #bottlewarmer #momsoftiktok ","HOW DARE YOU DR BROWNS, GET IT TOGETHER! #drbrowns #babyproducts #review #babyreview #millennialmom #millennialmoms #bottlewarmer #momsoftiktok ",,,,,,"[""drbrowns"", ""babyproducts"", ""review"", ""babyreview"", ""millennialmom"", ""millennialmoms"", ""bottlewarmer"", ""momsoftiktok""]",https://p16-common-sign.tiktokcdn.com/tos-useast5-p-0068-tx/0f49fe0feadc4b3ab8db31cd2f2000ed_1683136979~tplv-tiktokx-dmt-logom:tos-useast5-i-0068-tx/b723ada1d9d240e4bf97ef4bb80731d5.image?dr=14573&x-expires=1782374400&x-signature=SoKz8rXfw6DTfjEZWIdZIr1oPuU%3D&t=4d5b0474&ps=13740610&shp=81f88b70&shcp=43f4a2f9&idc=my,2026-06-23T08:07:44+00:00,ok,oembed,
17,https://www.tiktok.com/@theinmanfamblog/video/7246038193051553067,7246038193051553067,The Inman Fam,https://www.tiktok.com/@theinmanfamblog,Momcozy bottle warmers are *chef’s kiss* so easy and fast to use and work perfectly every time! #bottlewarmer #pumpingmom #pumpingjourney #pumpingmama #pumptok #justenougher #oversupplier #undersupplier #pumpjourney #breastfeedingjourney #pumpingtips #pumpinghacks #pumpingtip #breastfeedingtips #breastfeedinghack #bottlefeeding #bottlefeedingtips #momsoftiktok #momtip #newmomtip #breastfeeding ,Momcozy bottle warmers are *chef’s kiss* so easy and fast to use and work perfectly every time! #bottlewarmer #pumpingmom #pumpingjourney #pumpingmama #pumptok #justenougher #oversupplier #undersupplier #pumpjourney #breastfeedingjourney #pumpingtips #pumpinghacks #pumpingtip #breastfeedingtips #breastfeedinghack #bottlefeeding #bottlefeedingtips #momsoftiktok #momtip #newmomtip #breastfeeding ,,,,,,"[""bottlewarmer"", ""pumpingmom"", ""pumpingjourney"", ""pumpingmama"", ""pumptok"", ""justenougher"", ""oversupplier"", ""undersupplier"", ""pumpjourney"", ""breastfeedingjourney"", ""pumpingtips"", ""pumpinghacks"", ""pumpingtip"", ""breastfeedingtips"", ""breastfeedinghack"", ""bottlefeeding"", ""bottlefeedingtips"", ""momsoftiktok"", ""momtip"", ""newmomtip"", ""breastfeeding""]",https://p16-common-sign.tiktokcdn.com/tos-useast5-p-0068-tx/91ed7e92d2e342b1816bcc5203120c3a_1687099758~tplv-tiktokx-dmt-logom:tos-useast5-i-0068-tx/87fc047d712b4881bd1e86b91b2dfc84.image?dr=14573&x-expires=1782374400&x-signature=p59g5Hfx8t%2FaGcR%2FHCfyu6gKkD0%3D&t=4d5b0474&ps=13740610&shp=81f88b70&shcp=43f4a2f9&idc=my,2026-06-23T08:08:45+00:00,ok,oembed,
18,https://www.tiktok.com/@theregistrymama/video/7456447365608639774,7456447365608639774,theregistrymama,,,,,,,,,,,,failed,,"Client error '400 Bad Request' for url 'https://www.tiktok.com/oembed?url=https%3A%2F%2Fwww.tiktok.com%2F%40theregistrymama%2Fvideo%2F7456447365608639774'
For more information check: https://developer.mozilla.org/en-US/docs/Web/HTTP/Status/400"
19,https://www.tiktok.com/@loveeprinny/video/7439535973635050783,7439535973635050783,loveeprinny,https://www.tiktok.com/@loveeprinny,Portable Milk & Water Warmer is on sale! Get yours & a FREE Hip Carrier for your baby! Make sure you clip both coupons! #momcozymilkwarmer #momcozy #momsoftiktok #momlife #portablemilkwarmer #tiktokshopblackfriday #tiktokshopcybermonday,Portable Milk & Water Warmer is on sale! Get yours & a FREE Hip Carrier for your baby! Make sure you clip both coupons! #momcozymilkwarmer #momcozy #momsoftiktok #momlife #portablemilkwarmer #tiktokshopblackfriday #tiktokshopcybermonday,33,113500,766,49,242,"[""momcozymilkwarmer"", ""momcozy"", ""momsoftiktok"", ""momlife"", ""portablemilkwarmer"", ""tiktokshopblackfriday"", ""tiktokshopcybermonday""]",https://p16-common-sign.tiktokcdn.com/tos-useast8-p-0068-tx2/b775295469404d68b290f9e1c533de23_1732151969~tplv-tiktokx-dmt-logom:tos-useast8-i-0068-tx2/osGJULQxAC5eBAf7pcXGAsUeyAIRQAf1GRidIA.image?dr=14573&x-expires=1782374400&x-signature=aGw2%2Bk4CU%2BhE6ScKw7e%2FCAcKw4E%3D&t=4d5b0474&ps=13740610&shp=81f88b70&shcp=55bbe6a9&idc=my,2026-06-23T08:08:58+00:00,ok,playwright,
20,https://www.tiktok.com/@the_health_plug/video/7501454276888120622,7501454276888120622,Cory Webster,https://www.tiktok.com/@the_health_plug,Baby Brezza vs. Momcozy bottle warmer. Honest review.  #momcozy #momcozybottlewarmer #babybrezza #mommusthaves #momcozyreview ,Baby Brezza vs. Momcozy bottle warmer. Honest review.  #momcozy #momcozybottlewarmer #babybrezza #mommusthaves #momcozyreview ,,,,,,"[""momcozy"", ""momcozybottlewarmer"", ""babybrezza"", ""mommusthaves"", ""momcozyreview""]",https://p16-common-sign.tiktokcdn.com/tos-useast5-p-0068-tx/okPGBf8eEiYSIPhgNCogiBMaIqRoAncU0DwdEp~tplv-tiktokx-origin.image?dr=14575&x-expires=1782374400&x-signature=naS8YRfT%2BpUNVDHSNOPMvBtSx3M%3D&t=4d5b0474&ps=13740610&shp=81f88b70&shcp=43f4a2f9&idc=my,2026-06-23T08:09:58+00:00,ok,oembed,
21,https://www.tiktok.com/@h.a.branson/video/7467639437304859950,7467639437304859950,Hailey,https://www.tiktok.com/@h.a.branson,Did I do this right? Here are my ✨thoughts✨ @Baby Brezza  #BabyBrezza #BottleWarmer #BabyEssentials #ParentingHacks #MomLife #DadLife #BabyGear #ParentingMadeEasy #MomOnTheGo #BabyProducts #PortableBottleWarmer #MomMustHaves #NewParentEssentials #InfantCare #BabyTech #BabyLifeHacks #BabyRegistry #NoColdBottles   ,Did I do this right? Here are my ✨thoughts✨ @Baby Brezza  #BabyBrezza #BottleWarmer #BabyEssentials #ParentingHacks #MomLife #DadLife #BabyGear #ParentingMadeEasy #MomOnTheGo #BabyProducts #PortableBottleWarmer #MomMustHaves #NewParentEssentials #InfantCare #BabyTech #BabyLifeHacks #BabyRegistry #NoColdBottles   ,,,,,,"[""BabyBrezza"", ""BottleWarmer"", ""BabyEssentials"", ""ParentingHacks"", ""MomLife"", ""DadLife"", ""BabyGear"", ""ParentingMadeEasy"", ""MomOnTheGo"", ""BabyProducts"", ""PortableBottleWarmer"", ""MomMustHaves"", ""NewParentEssentials"", ""InfantCare"", ""BabyTech"", ""BabyLifeHacks"", ""BabyRegistry"", ""NoColdBottles""]",https://p16-common-sign.tiktokcdn.com/tos-useast5-p-0068-tx/oAoAiBilrCBpRQg7eYyZi1iDf0SBqnIEY8EZSZ~tplv-tiktokx-origin.image?dr=14575&x-expires=1782374400&x-signature=rjIsORzwL226iUWKe5kwXlWK6Ek%3D&t=4d5b0474&ps=13740610&shp=81f88b70&shcp=43f4a2f9&idc=my,2026-06-23T08:10:59+00:00,ok,oembed,
22,https://www.tiktok.com/@lloyd__co/video/7335273528473783595,7335273528473783595,lloyd__co,https://www.tiktok.com/@lloyd__co,The Baby Brezza bottle warmer is always more of a science experiment than I care for 🍼🔥 #breastfeedingprobs #breastfeedingworkingmom #exclusivepumpingmama #babybrezza,The Baby Brezza bottle warmer is always more of a science experiment than I care for 🍼🔥 #breastfeedingprobs #breastfeedingworkingmom #exclusivepumpingmama #babybrezza,14,125900,642,11,22,"[""breastfeedingprobs"", ""breastfeedingworkingmom"", ""exclusivepumpingmama"", ""babybrezza""]",https://p16-common-sign.tiktokcdn.com/tos-useast5-p-0068-tx/3e23dcc2dc9d40c2bc5a82c5e1ad249e_1707876484~tplv-tiktokx-origin.image?dr=14575&x-expires=1782374400&x-signature=k1KFMFzJ9yxyexs%2BvrDlmLhZg4Q%3D&t=4d5b0474&ps=13740610&shp=81f88b70&shcp=55bbe6a9&idc=my,2026-06-23T08:11:05+00:00,ok,playwright,
23,https://www.tiktok.com/@tiffanymariekohut/video/7476987220591660319,7476987220591660319,tiffanymariekohut,https://www.tiktok.com/@tiffanymariekohut,Are they essentially the same?? Which one do I go with?!😂🫠 #babybrezza #babybrezzasterilizer #momcozy #momcozysterilizer,Are they essentially the same?? Which one do I go with?!😂🫠 #babybrezza #babybrezzasterilizer #momcozy #momcozysterilizer,30,7887,24,16,1,"[""babybrezza"", ""babybrezzasterilizer"", ""momcozy"", ""momcozysterilizer""]",https://p16-common-sign.tiktokcdn.com/tos-useast8-p-0068-tx2/ocZJBcdOEnXiA8AESAvRDmEFGiYA7iABDzlI7~tplv-tiktokx-dmt-logom:tos-useast8-i-0068-tx2/ocACTeBfjPEGDqImEVDDeCFzAFthAAkE85mAII.image?dr=14573&x-expires=1782374400&x-signature=6jKiM91BTF%2BmTasY6JZ4temFAgE%3D&t=4d5b0474&ps=13740610&shp=81f88b70&shcp=55bbe6a9&idc=my,2026-06-23T08:11:18+00:00,ok,playwright,
